{
  "$schema": "https://json-schema.org/draft/2020-12/schema",
  "$id": "plcexport/safety.schema.json",
  "title": "safety/safety.json (contract §7)",
  "type": "object",
  "required": [
    "units",
    "tags",
    "parameters",
    "signatures"
  ],
  "properties": {
    "units": {
      "type": "array",
      "items": {
        "type": "string"
      },
      "uniqueItems": true
    },
    "tags": {
      "type": "array",
      "items": {
        "type": "string"
      },
      "uniqueItems": true
    },
    "parameters": {
      "type": "array",
      "items": {
        "type": "object",
        "required": [
          "scope",
          "name",
          "value"
        ],
        "properties": {
          "scope": {
            "type": "string"
          },
          "name": {
            "type": "string"
          },
          "value": {
            "type": "string"
          }
        },
        "additionalProperties": false
      }
    },
    "signatures": {
      "type": "array",
      "items": {
        "type": "object",
        "required": [
          "scope",
          "value",
          "kind"
        ],
        "properties": {
          "scope": {
            "type": "string"
          },
          "value": {
            "type": "string"
          },
          "kind": {
            "type": "string"
          }
        },
        "additionalProperties": false
      }
    }
  },
  "additionalProperties": false
}
